logged_at,reason,name,title,url,query
2026-04-22T06:47:58.483445Z,non_org_title,List of non-governmental organizations in China - Wikipedia,List of non-governmental organizations in China - Wikipedia,,"""List of non-governmental organizations in China - Wikipedia"" ""China"" organization"
2026-04-22T06:47:59.049597Z,non_org_title,List of non-governmental organizations in China This article,List of non-governmental organizations in China This article,,"""List of non-governmental organizations in China This article"" ""China"" organization"
2026-04-22T06:47:59.596934Z,non_org_title,NGO Directory - China Development Brief,NGO Directory - China Development Brief,,"""NGO Directory - China Development Brief"" ""China"" organization"
2026-04-22T06:48:00.156134Z,non_org_title,"List of Ngos, Charities and non-profits in China - NGO Base","List of Ngos, Charities and non-profits in China - NGO Base",,"""List of Ngos, Charities and non-profits in China - NGO Base"" ""China"" organization"
2026-04-22T06:48:00.704095Z,missing_url,CN/china-ngos,CN/china-ngos,,"""CN/china-ngos"" ""China"" organization"
2026-04-22T06:48:01.252116Z,missing_url,Recording Civic Action in China - Spotlight Exhibits,Recording Civic Action in China - Spotlight Exhibits,,"""Recording Civic Action in China - Spotlight Exhibits"" ""China"" organization"
2026-04-22T06:48:01.811576Z,non_org_title,Worldwide NGO Directory,Worldwide NGO Directory,,"""Worldwide NGO Directory"" ""China"" organization"
2026-04-22T06:48:02.356099Z,non_org_title,The Worldwide NGO Directory,The Worldwide NGO Directory,,"""The Worldwide NGO Directory"" ""China"" organization"
2026-04-22T06:48:02.913097Z,missing_url,Civil Society Organizations (CSOs) - United Nations Development Programme,Civil Society Organizations (CSOs) - United Nations Development Programme,,"""Civil Society Organizations (CSOs) - United Nations Development Programme"" ""China"" organization"
2026-04-22T06:48:03.475251Z,missing_url,China NGO Network for International Exchanges - cnie.org.cn,China NGO Network for International Exchanges - cnie.org.cn,,"""China NGO Network for International Exchanges - cnie.org.cn"" ""China"" organization"
2026-04-22T06:48:04.036148Z,missing_url,Together to Implement the Global Development Initiative China,Together to Implement the Global Development Initiative China,,"""Together to Implement the Global Development Initiative China"" ""China"" organization"
2026-04-22T06:48:04.594356Z,missing_url,NGO Project - ChinaFile,NGO Project - ChinaFile,,"""NGO Project - ChinaFile"" ""China"" organization"
2026-04-22T06:48:05.151284Z,missing_url,The China NGO Project is a community,The China NGO Project is a community,,"""The China NGO Project is a community"" ""China"" organization"
